bill_id,session_id,bill_number,status,status_desc,status_date,title,description,committee_id,committee,last_action_date,last_action,url,state_link
2017534,2162,HB1941,4,Passed,2025-04-17,"Concerning Department Of Education Boards And Commissions; And To Protect Arkansas Students By Ensuring The Efficient Disposition Of Ethics Complaints Against Teachers.","Concerning Department Of Education Boards And Commissions; And To Protect Arkansas Students By Ensuring The Efficient Disposition Of Ethics Complaints Against Teachers.",0,,2025-04-17,"Notification that HB1941 is now Act 809",https://legiscan.com/AR/bill/HB1941/2025,https://arkleg.state.ar.us/Bills/Detail?id=hb1941&ddBienniumSession=2025%2F2025R
2017536,2162,HB1942,4,Passed,2025-04-22,"To Require Certain Reimbursement Rates For Home- And Community-based Services Within Risk-based Provider Organizations.","To Require Certain Reimbursement Rates For Home- And Community-based Services Within Risk-based Provider Organizations.",0,,2025-04-22,"Notification that HB1942 is now Act 1023",https://legiscan.com/AR/bill/HB1942/2025,https://arkleg.state.ar.us/Bills/Detail?id=hb1942&ddBienniumSession=2025%2F2025R
2017574,2162,HB1943,4,Passed,2025-04-21,"To Amend The Medicaid Provider-led Organized Care Act; To Improve The Enrollment And Selection Process In Risk-based Provider Organizations; And To Empower Beneficiaries With Information.","To Amend The Medicaid Provider-led Organized Care Act; To Improve The Enrollment And Selection Process In Risk-based Provider Organizations; And To Empower Beneficiaries With Information.",0,,2025-04-21,"Notification that HB1943 is now Act 962",https://legiscan.com/AR/bill/HB1943/2025,https://arkleg.state.ar.us/Bills/Detail?id=hb1943&ddBienniumSession=2025%2F2025R
2017569,2162,HB1944,6,Failed,2025-05-05,"To Authorize The Issuance And Renewal Of A Special License Plate To Promote And Support The Arkansas Ems Foundation; And To Repeal The Grand Lodge Of Arkansas Special License Plate.","To Authorize The Issuance And Renewal Of A Special License Plate To Promote And Support The Arkansas Ems Foundation; And To Repeal The Grand Lodge Of Arkansas Special License Plate.",0,,2025-05-05,"Died in Senate Committee at Sine Die adjournment.",https://legiscan.com/AR/bill/HB1944/2025,https://arkleg.state.ar.us/Bills/Detail?id=hb1944&ddBienniumSession=2025%2F2025R
2017567,2162,HB1945,4,Passed,2025-04-21,"To Amend The Arkansas Opportunity Public School Choice Act; To Amend The Public School Choice Act Of 2015; And To Allow A Student To Transfer To Another Public School Within His Or Her Resident District.","To Amend The Arkansas Opportunity Public School Choice Act; To Amend The Public School Choice Act Of 2015; And To Allow A Student To Transfer To Another Public School Within His Or Her Resident District.",0,,2025-04-21,"Notification that HB1945 is now Act 913",https://legiscan.com/AR/bill/HB1945/2025,https://arkleg.state.ar.us/Bills/Detail?id=hb1945&ddBienniumSession=2025%2F2025R
2017953,2162,HB1946,6,Failed,2025-05-05,"To Require Human Growth And Development Instruction In Public Schools.","To Require Human Growth And Development Instruction In Public Schools.",0,,2025-05-05,"Died in Senate Committee at Sine Die adjournment.",https://legiscan.com/AR/bill/HB1946/2025,https://arkleg.state.ar.us/Bills/Detail?id=hb1946&ddBienniumSession=2025%2F2025R
2017888,2162,HB1947,6,Failed,2025-05-05,"To Amend The Law Concerning The Offense Of Possession Of Drug Paraphernalia.","To Amend The Law Concerning The Offense Of Possession Of Drug Paraphernalia.",0,,2025-05-05,"Died in House Committee at Sine Die adjournment.",https://legiscan.com/AR/bill/HB1947/2025,https://arkleg.state.ar.us/Bills/Detail?id=hb1947&ddBienniumSession=2025%2F2025R
2017743,2162,HB1948,6,Failed,2025-05-05,"To Amend The Conditions Under Which The Offense Of Negligent Homicide Is Committed; And To Repeal The Ability Of A Prosecuting Attorney Or Defendant To Subpoena Certain Individuals Before A Hearing Or Trial.","To Amend The Conditions Under Which The Offense Of Negligent Homicide Is Committed; And To Repeal The Ability Of A Prosecuting Attorney Or Defendant To Subpoena Certain Individuals Before A Hearing Or Trial.",0,,2025-05-05,"Died in House Committee at Sine Die adjournment.",https://legiscan.com/AR/bill/HB1948/2025,https://arkleg.state.ar.us/Bills/Detail?id=hb1948&ddBienniumSession=2025%2F2025R
2018127,2162,HB1949,6,Failed,2025-05-05,"To Add Medical, Emergency Medical, And Ambulance Services To The List Of Professional Services For Purposes Of Procurement.","To Add Medical, Emergency Medical, And Ambulance Services To The List Of Professional Services For Purposes Of Procurement.",0,,2025-05-05,"Died in Senate Committee at Sine Die adjournment.",https://legiscan.com/AR/bill/HB1949/2025,https://arkleg.state.ar.us/Bills/Detail?id=hb1949&ddBienniumSession=2025%2F2025R
2018156,2162,HB1950,1,Introduced,2025-04-01,"To Protect Licensed Family Childcare Homes From Termination Of Homeowners Insurance Coverage; And To Prohibit Discrimination Against Licensed Family Childcare Homes By Homeowners Insurance Providers.","To Protect Licensed Family Childcare Homes From Termination Of Homeowners Insurance Coverage; And To Prohibit Discrimination Against Licensed Family Childcare Homes By Homeowners Insurance Providers.",0,,2025-04-08,"Recommended for study in the Interim by the Committee on INSURANCE & COMMERCE- HOUSE",https://legiscan.com/AR/bill/HB1950/2025,https://arkleg.state.ar.us/Bills/Detail?id=hb1950&ddBienniumSession=2025%2F2025R
2018268,2162,HB1951,4,Passed,2025-04-21,"To Set Forth Authorized Domain Extensions For Higher Education And Government Websites.","To Set Forth Authorized Domain Extensions For Higher Education And Government Websites.",0,,2025-04-21,"Notification that HB1951 is now Act 929",https://legiscan.com/AR/bill/HB1951/2025,https://arkleg.state.ar.us/Bills/Detail?id=hb1951&ddBienniumSession=2025%2F2025R
2017987,2162,HB1952,4,Passed,2025-04-21,"To Assist The Administration Of The State Athletic Commission; To Provide Funding To The State Athletic Commission To Continue Its Mission To Promote A Robust, Healthy, And Safe Combative Sports Industry. ","To Assist The Administration Of The State Athletic Commission; To Provide Funding To The State Athletic Commission To Continue Its Mission To Promote A Robust, Healthy, And Safe Combative Sports Industry. ",0,,2025-04-21,"Notification that HB1952 is now Act 947",https://legiscan.com/AR/bill/HB1952/2025,https://arkleg.state.ar.us/Bills/Detail?id=hb1952&ddBienniumSession=2025%2F2025R
2017963,2162,HB1953,6,Failed,2025-05-05,"To Provide For A Surcharge To Be Assessed On Inmate Phone Calls To Offset The Costs Of Security Needs Associated With Inmate Communications.","To Provide For A Surcharge To Be Assessed On Inmate Phone Calls To Offset The Costs Of Security Needs Associated With Inmate Communications.",0,,2025-05-05,"Died in House Committee at Sine Die adjournment.",https://legiscan.com/AR/bill/HB1953/2025,https://arkleg.state.ar.us/Bills/Detail?id=hb1953&ddBienniumSession=2025%2F2025R
2018016,2162,HB1954,4,Passed,2025-04-17,"To Create The Arkansas Behavior Analyst Registration Act; And To Include Qualified Behavior Analysts Under The Arkansas Behavior Analyst Registration Act.","To Create The Arkansas Behavior Analyst Registration Act; And To Include Qualified Behavior Analysts Under The Arkansas Behavior Analyst Registration Act.",0,,2025-04-17,"Notification that HB1954 is now Act 869",https://legiscan.com/AR/bill/HB1954/2025,https://arkleg.state.ar.us/Bills/Detail?id=hb1954&ddBienniumSession=2025%2F2025R
2018213,2162,HB1955,6,Failed,2025-05-05,"To Repeal The Shielded Outdoor Lighting Act.","To Repeal The Shielded Outdoor Lighting Act.",0,,2025-05-05,"Died in Senate Committee at Sine Die adjournment.",https://legiscan.com/AR/bill/HB1955/2025,https://arkleg.state.ar.us/Bills/Detail?id=hb1955&ddBienniumSession=2025%2F2025R
2018351,2162,HB1956,6,Failed,2025-05-05,"To Create The Arkansas Nighttime Environment Protection Act.","To Create The Arkansas Nighttime Environment Protection Act.",0,,2025-05-05,"Died in Senate Committee at Sine Die adjournment.",https://legiscan.com/AR/bill/HB1956/2025,https://arkleg.state.ar.us/Bills/Detail?id=hb1956&ddBienniumSession=2025%2F2025R
2018295,2162,HB1957,4,Passed,2025-04-17,"To Amend The Unsolicited Commercial And Sexually Explicit Electronic Mail Prevention Act To Include Unsolicited Commercial And Sexually Explicit Text Messages.","To Amend The Unsolicited Commercial And Sexually Explicit Electronic Mail Prevention Act To Include Unsolicited Commercial And Sexually Explicit Text Messages.",0,,2025-04-17,"Notification that HB1957 is now Act 847",https://legiscan.com/AR/bill/HB1957/2025,https://arkleg.state.ar.us/Bills/Detail?id=hb1957&ddBienniumSession=2025%2F2025R
2018186,2162,HB1958,4,Passed,2025-04-17,"To Require Public Entities To Create A Policy Concerning The Authorized Use Of Artificial Intelligence.","To Require Public Entities To Create A Policy Concerning The Authorized Use Of Artificial Intelligence.",0,,2025-04-17,"Notification that HB1958 is now Act 848",https://legiscan.com/AR/bill/HB1958/2025,https://arkleg.state.ar.us/Bills/Detail?id=hb1958&ddBienniumSession=2025%2F2025R
2018072,2162,HB1959,4,Passed,2025-04-22,"To Abolish The Use Of A Writ Of Scire Facias As The Means Of Reviving An Outstanding Judgment; To Allow A Judgment To Be Revived By Notice; And To Amend The Law Concerning The Fees To Be Charged By Clerks Of The Circuit Courts.","To Abolish The Use Of A Writ Of Scire Facias As The Means Of Reviving An Outstanding Judgment; To Allow A Judgment To Be Revived By Notice; And To Amend The Law Concerning The Fees To Be Charged By Clerks Of The Circuit Courts.",0,,2025-04-22,"Notification that HB1959 is now Act 986",https://legiscan.com/AR/bill/HB1959/2025,https://arkleg.state.ar.us/Bills/Detail?id=hb1959&ddBienniumSession=2025%2F2025R
2018398,2162,HB1960,4,Passed,2025-04-22,"To Provide That The Lessee Of A Leased Motor Vehicle Is The Owner For Purposes Of The Assessment And Payment Of Property Taxes; And To Amend The Law Concerning Local Sales And Use Taxes On Certain Tangible Personal Property.","To Provide That The Lessee Of A Leased Motor Vehicle Is The Owner For Purposes Of The Assessment And Payment Of Property Taxes; And To Amend The Law Concerning Local Sales And Use Taxes On Certain Tangible Personal Property.",0,,2025-04-22,"Notification that HB1960 is now Act 1013",https://legiscan.com/AR/bill/HB1960/2025,https://arkleg.state.ar.us/Bills/Detail?id=hb1960&ddBienniumSession=2025%2F2025R
2018572,2162,HB1961,5,Vetoed,2025-04-22,"To Allow Medical Providers Temporary Exemptions From Federal Information-blocking Regulations To Safeguard Patients During Information Disclosure; And To Declare An Emergency.","To Allow Medical Providers Temporary Exemptions From Federal Information-blocking Regulations To Safeguard Patients During Information Disclosure; And To Declare An Emergency.",0,,2025-05-07,"Delivered to the Secretary of State",https://legiscan.com/AR/bill/HB1961/2025,https://arkleg.state.ar.us/Bills/Detail?id=hb1961&ddBienniumSession=2025%2F2025R
2018432,2162,HB1962,1,Introduced,2025-04-01,"To Prohibit A School From Serving Or Selling Ultra-processed Food On The School Campus During The Normal School Day.","To Prohibit A School From Serving Or Selling Ultra-processed Food On The School Campus During The Normal School Day.",0,,2025-04-15,"Recommended for study in the Interim by the Committee on EDUCATION COMMITTEE- HOUSE",https://legiscan.com/AR/bill/HB1962/2025,https://arkleg.state.ar.us/Bills/Detail?id=hb1962&ddBienniumSession=2025%2F2025R
2018451,2162,HB1963,4,Passed,2025-04-21,"To Clarify That An Advanced Practice Registered Nurse Who Prescribes A Stimulant May Substitute A Therapeutically Equivalent Medication.","To Clarify That An Advanced Practice Registered Nurse Who Prescribes A Stimulant May Substitute A Therapeutically Equivalent Medication.",0,,2025-04-21,"Notification that HB1963 is now Act 963",https://legiscan.com/AR/bill/HB1963/2025,https://arkleg.state.ar.us/Bills/Detail?id=hb1963&ddBienniumSession=2025%2F2025R
2018414,2162,HB1964,4,Passed,2025-04-17,"To Move The Child Welfare Ombudsman Division And The Juvenile Ombudsman Division To The Department Of Inspector General; And To Declare An Emergency.","To Move The Child Welfare Ombudsman Division And The Juvenile Ombudsman Division To The Department Of Inspector General; And To Declare An Emergency.",0,,2025-04-17,"Notification that HB1964 is now Act 825",https://legiscan.com/AR/bill/HB1964/2025,https://arkleg.state.ar.us/Bills/Detail?id=hb1964&ddBienniumSession=2025%2F2025R
2018441,2162,HB1965,4,Passed,2025-04-17,"To Create The Arkansas Healthy Food Retail Act Of 2025; And To Provide Financial Incentives For Healthy Food Retailers In Underserved Communities.","To Create The Arkansas Healthy Food Retail Act Of 2025; And To Provide Financial Incentives For Healthy Food Retailers In Underserved Communities.",0,,2025-04-17,"Notification that HB1965 is now Act 870",https://legiscan.com/AR/bill/HB1965/2025,https://arkleg.state.ar.us/Bills/Detail?id=hb1965&ddBienniumSession=2025%2F2025R
2018597,2162,HB1966,4,Passed,2025-04-21,"To Authorize An Incorporated Town Or A City Of The Second Class To Petition The State Board Of Education For The Establishment Of A Local Public Elementary School Or Satellite School Under Certain Conditions.","To Authorize An Incorporated Town Or A City Of The Second Class To Petition The State Board Of Education For The Establishment Of A Local Public Elementary School Or Satellite School Under Certain Conditions.",0,,2025-04-21,"Notification that HB1966 is now Act 914",https://legiscan.com/AR/bill/HB1966/2025,https://arkleg.state.ar.us/Bills/Detail?id=hb1966&ddBienniumSession=2025%2F2025R
2018474,2162,HB1967,4,Passed,2025-04-22,"To Amend The Law Concerning The Unlawful Distribution Of Sexual Images Or Recordings.","To Amend The Law Concerning The Unlawful Distribution Of Sexual Images Or Recordings.",0,,2025-04-22,"Notification that HB1967 is now Act 981",https://legiscan.com/AR/bill/HB1967/2025,https://arkleg.state.ar.us/Bills/Detail?id=hb1967&ddBienniumSession=2025%2F2025R
2018546,2162,HB1968,1,Introduced,2025-04-01,"To Require The Collection Of Sales Tax At The Point Of Sale For The Sale Of A New Or Used Motor Vehicle, Trailer, Or Semitrailer By A Dealer; And To Amend Law Affirmed By Referred Act 19 Of 1958.","To Require The Collection Of Sales Tax At The Point Of Sale For The Sale Of A New Or Used Motor Vehicle, Trailer, Or Semitrailer By A Dealer; And To Amend Law Affirmed By Referred Act 19 Of 1958.",0,,2025-04-15,"Recommended for study in the Interim by the Committee on REVENUE & TAXATION- HOUSE",https://legiscan.com/AR/bill/HB1968/2025,https://arkleg.state.ar.us/Bills/Detail?id=hb1968&ddBienniumSession=2025%2F2025R
2018523,2162,HB1969,6,Failed,2025-05-05,"To Improve The Quality Of Healthcare Access; To Amend The Assessment Fees On Hospitals; And To Create The Hospital Directed Payment Assessment.","To Improve The Quality Of Healthcare Access; To Amend The Assessment Fees On Hospitals; And To Create The Hospital Directed Payment Assessment.",0,,2025-05-05,"Died on House Calendar at Sine Die adjournment.",https://legiscan.com/AR/bill/HB1969/2025,https://arkleg.state.ar.us/Bills/Detail?id=hb1969&ddBienniumSession=2025%2F2025R
2018626,2162,HB1970,6,Failed,2025-05-05,"To Amend The Law Concerning The Prepayment Of Sales Tax; And To Increase The Threshold For Retailers Who Are Required To Prepay Sales Tax.","To Amend The Law Concerning The Prepayment Of Sales Tax; And To Increase The Threshold For Retailers Who Are Required To Prepay Sales Tax.",0,,2025-05-05,"Died in House Committee at Sine Die adjournment.",https://legiscan.com/AR/bill/HB1970/2025,https://arkleg.state.ar.us/Bills/Detail?id=hb1970&ddBienniumSession=2025%2F2025R
2018747,2162,HB1971,6,Failed,2025-05-05,"To Amend The Requirements Concerning The Information That Shall Be Provided To A City Or County By The Department Of Finance And Administration.","To Amend The Requirements Concerning The Information That Shall Be Provided To A City Or County By The Department Of Finance And Administration.",0,,2025-05-05,"Died in House Committee at Sine Die adjournment.",https://legiscan.com/AR/bill/HB1971/2025,https://arkleg.state.ar.us/Bills/Detail?id=hb1971&ddBienniumSession=2025%2F2025R
2018999,2162,HB1972,6,Failed,2025-05-05,"To Create A Sales And Use Tax Exemption For The Helena West Helena Future Leaders Youth Sports Association.","To Create A Sales And Use Tax Exemption For The Helena West Helena Future Leaders Youth Sports Association.",0,,2025-05-05,"Died in House Committee at Sine Die adjournment.",https://legiscan.com/AR/bill/HB1972/2025,https://arkleg.state.ar.us/Bills/Detail?id=hb1972&ddBienniumSession=2025%2F2025R
2018939,2162,HB1973,6,Failed,2025-05-05,"To Provide That A Governmental Body Shall Not Use State Or Local Funds To Enter Into A Contract With A Lobbyist For The Purpose Of Lobbying On Behalf Of The Governmental Body.","To Provide That A Governmental Body Shall Not Use State Or Local Funds To Enter Into A Contract With A Lobbyist For The Purpose Of Lobbying On Behalf Of The Governmental Body.",0,,2025-05-05,"Died in House Committee at Sine Die adjournment.",https://legiscan.com/AR/bill/HB1973/2025,https://arkleg.state.ar.us/Bills/Detail?id=hb1973&ddBienniumSession=2025%2F2025R
2019054,2162,HB1974,4,Passed,2025-04-21,"To Prohibit State Entities From Employing Unauthorized Aliens; To Establish The E-verify Requirement Act; And To Require State Entities To Use E-verify To Confirm Employment Eligibility.","To Prohibit State Entities From Employing Unauthorized Aliens; To Establish The E-verify Requirement Act; And To Require State Entities To Use E-verify To Confirm Employment Eligibility.",0,,2025-04-21,"Notification that HB1974 is now Act 948",https://legiscan.com/AR/bill/HB1974/2025,https://arkleg.state.ar.us/Bills/Detail?id=hb1974&ddBienniumSession=2025%2F2025R
2019277,2162,HB1975,4,Passed,2025-04-22,"To Create The Child Content Creation Protection Act.","To Create The Child Content Creation Protection Act.",0,,2025-04-22,"Notification that HB1975 is now Act 982",https://legiscan.com/AR/bill/HB1975/2025,https://arkleg.state.ar.us/Bills/Detail?id=hb1975&ddBienniumSession=2025%2F2025R
2019260,2162,HB1976,4,Passed,2025-04-17,"Concerning Vertiports; And To Create The Open Access To Public-use Vertiports Act.","Concerning Vertiports; And To Create The Open Access To Public-use Vertiports Act.",0,,2025-04-17,"Notification that HB1976 is now Act 883",https://legiscan.com/AR/bill/HB1976/2025,https://arkleg.state.ar.us/Bills/Detail?id=hb1976&ddBienniumSession=2025%2F2025R
2019346,2162,HB1977,6,Failed,2025-05-05,"To Create The Protecting Childhood Innocence In Libraries Act. ","To Create The Protecting Childhood Innocence In Libraries Act. ",0,,2025-05-05,"Died in House Committee at Sine Die adjournment.",https://legiscan.com/AR/bill/HB1977/2025,https://arkleg.state.ar.us/Bills/Detail?id=hb1977&ddBienniumSession=2025%2F2025R
2019356,2162,HB1978,6,Failed,2025-05-05,"To Add An Additional Judgeship To The Seventeenth District Of The State District Court System. ","To Add An Additional Judgeship To The Seventeenth District Of The State District Court System. ",0,,2025-05-05,"Died in House Committee at Sine Die adjournment.",https://legiscan.com/AR/bill/HB1978/2025,https://arkleg.state.ar.us/Bills/Detail?id=hb1978&ddBienniumSession=2025%2F2025R
2019284,2162,HB1979,4,Passed,2025-04-22,"An Act To Amend Arkansas Law To Allow Warrantless Searches By A Law Enforcement Officer Of A Person Placed On Suspended Imposition Of Sentence; And For Other Purposes. ","An Act To Amend Arkansas Law To Allow Warrantless Searches By A Law Enforcement Officer Of A Person Placed On Suspended Imposition Of Sentence; And For Other Purposes. ",0,,2025-04-22,"Notification that HB1979 is now Act 983",https://legiscan.com/AR/bill/HB1979/2025,https://arkleg.state.ar.us/Bills/Detail?id=hb1979&ddBienniumSession=2025%2F2025R
2019295,2162,HB1980,6,Failed,2025-05-05,"To Create The Technology And Energy For Sustainable Logistics Act (tesla); And To Add Electric Vehicle Charging Stations To The Definition Of &quot;critical Infrastructure&quot;.","To Create The Technology And Energy For Sustainable Logistics Act (tesla); And To Add Electric Vehicle Charging Stations To The Definition Of &quot;critical Infrastructure&quot;.",0,,2025-05-05,"Died in House Committee at Sine Die adjournment.",https://legiscan.com/AR/bill/HB1980/2025,https://arkleg.state.ar.us/Bills/Detail?id=hb1980&ddBienniumSession=2025%2F2025R
2019621,2162,HB1981,6,Failed,2025-05-05,"To Amend The Definitions Of &quot;outdoor Recreation Operator&quot; And &quot;tramway Operator Under The Law Concerning Recreational Tramways&quot;.","To Amend The Definitions Of &quot;outdoor Recreation Operator&quot; And &quot;tramway Operator Under The Law Concerning Recreational Tramways&quot;.",0,,2025-05-05,"Died in Senate Committee at Sine Die adjournment.",https://legiscan.com/AR/bill/HB1981/2025,https://arkleg.state.ar.us/Bills/Detail?id=hb1981&ddBienniumSession=2025%2F2025R
2019959,2162,HB1982,6,Failed,2025-05-05,"To Amend The Used Tire Recycling And Accountability Act; To Create The Tire Management And Recycling Act; To Repeal The Used Tire Recycling Fund; And To Create The Waste Tire Abatement Fund.","To Amend The Used Tire Recycling And Accountability Act; To Create The Tire Management And Recycling Act; To Repeal The Used Tire Recycling Fund; And To Create The Waste Tire Abatement Fund.",0,,2025-05-05,"Died in Senate Committee at Sine Die adjournment.",https://legiscan.com/AR/bill/HB1982/2025,https://arkleg.state.ar.us/Bills/Detail?id=hb1982&ddBienniumSession=2025%2F2025R
2019837,2162,HB1983,4,Passed,2025-04-22,"To Amend Acts 1973, No. 167, &#xa7; 4, Concerning The Sale Of Certain Property To The Westark Area Council, Inc., Boy Scouts Of America.","To Amend Acts 1973, No. 167, &#xa7; 4, Concerning The Sale Of Certain Property To The Westark Area Council, Inc., Boy Scouts Of America.",0,,2025-04-22,"Notification that HB1983 is now Act 1026",https://legiscan.com/AR/bill/HB1983/2025,https://arkleg.state.ar.us/Bills/Detail?id=hb1983&ddBienniumSession=2025%2F2025R
2019742,2162,HB1984,4,Passed,2025-04-22,"To Create A Designation For A Registered Sex Offender On A Driver&#x27;s License Or Identification Card.","To Create A Designation For A Registered Sex Offender On A Driver&#x27;s License Or Identification Card.",0,,2025-04-22,"Notification that HB1984 is now Act 984",https://legiscan.com/AR/bill/HB1984/2025,https://arkleg.state.ar.us/Bills/Detail?id=hb1984&ddBienniumSession=2025%2F2025R
2019900,2162,HB1985,6,Failed,2025-05-05,"To Create The Arkansas Renter Refund Act; And To Provide An Income Tax Credit For Certain Taxpayers Who Are Residential Tenants.","To Create The Arkansas Renter Refund Act; And To Provide An Income Tax Credit For Certain Taxpayers Who Are Residential Tenants.",0,,2025-05-05,"Died in House Committee at Sine Die adjournment.",https://legiscan.com/AR/bill/HB1985/2025,https://arkleg.state.ar.us/Bills/Detail?id=hb1985&ddBienniumSession=2025%2F2025R
2019774,2162,HB1986,4,Passed,2025-04-17,"Concerning Excused Absences For Children Of Fallen Service Members And Children Of Fallen First Responders.","Concerning Excused Absences For Children Of Fallen Service Members And Children Of Fallen First Responders.",0,,2025-04-17,"Notification that HB1986 is now Act 794",https://legiscan.com/AR/bill/HB1986/2025,https://arkleg.state.ar.us/Bills/Detail?id=hb1986&ddBienniumSession=2025%2F2025R
2020110,2162,HB1987,6,Failed,2025-05-05,"To Amend The Law Concerning The State Board Of Embalmers, Funeral Directors, Cemeteries, And Burial Services; And To Increase The Civil Penalty For Violations By A Licensee.","To Amend The Law Concerning The State Board Of Embalmers, Funeral Directors, Cemeteries, And Burial Services; And To Increase The Civil Penalty For Violations By A Licensee.",0,,2025-05-05,"Died in Senate Committee at Sine Die adjournment.",https://legiscan.com/AR/bill/HB1987/2025,https://arkleg.state.ar.us/Bills/Detail?id=hb1987&ddBienniumSession=2025%2F2025R
2020158,2162,HB1988,4,Passed,2025-04-21,"To Amend The Law Concerning The Distribution Of Auto Auction Fees For Salvage-titled Or Parts-only Titled Vehicles; And To Amend The Purpose For Which Auto Auction Fees May Be Used.","To Amend The Law Concerning The Distribution Of Auto Auction Fees For Salvage-titled Or Parts-only Titled Vehicles; And To Amend The Purpose For Which Auto Auction Fees May Be Used.",0,,2025-04-21,"Notification that HB1988 is now Act 930",https://legiscan.com/AR/bill/HB1988/2025,https://arkleg.state.ar.us/Bills/Detail?id=hb1988&ddBienniumSession=2025%2F2025R
2020075,2162,HB1989,6,Failed,2025-05-05,"To Amend The Law Concerning Used Motor Vehicles Buyers Protection; And To Amend The Law Concerning The Used Motor Vehicle Dealer&#x27;s License Application Process.","To Amend The Law Concerning Used Motor Vehicles Buyers Protection; And To Amend The Law Concerning The Used Motor Vehicle Dealer&#x27;s License Application Process.",0,,2025-05-05,"Died in House Committee at Sine Die adjournment.",https://legiscan.com/AR/bill/HB1989/2025,https://arkleg.state.ar.us/Bills/Detail?id=hb1989&ddBienniumSession=2025%2F2025R
2020042,2162,HB1990,1,Introduced,2025-04-03,"To Amend The Law Concerning Higher Education.","To Amend The Law Concerning Higher Education.",0,,2025-04-16,"Recommended for study in the Interim by the Committee on EDUCATION COMMITTEE- HOUSE",https://legiscan.com/AR/bill/HB1990/2025,https://arkleg.state.ar.us/Bills/Detail?id=hb1990&ddBienniumSession=2025%2F2025R
