bill_id,session_id,bill_number,status,status_desc,status_date,title,description,committee_id,committee,last_action_date,last_action,url,state_link
1974787,2162,SB256,6,Failed,2025-05-05,"To Amend The Arkansas Corporate Franchise Tax Act Of 1979; And To Reduce The Minimum Franchise Tax For Certain Corporations.","To Amend The Arkansas Corporate Franchise Tax Act Of 1979; And To Reduce The Minimum Franchise Tax For Certain Corporations.",0,,2025-05-05,"Died in Senate Committee at Sine Die adjournment.",https://legiscan.com/AR/bill/SB256/2025,https://arkleg.state.ar.us/Bills/Detail?id=sb256&ddBienniumSession=2025%2F2025R
1974939,2162,SB257,4,Passed,2025-04-10,"To Amend The Medicaid Fairness Act; To Extend The Appeal Period For Providers In The Arkansas Medicaid Program; And To Require Comprehensive Information In Notices Of Adverse Decisions.","To Amend The Medicaid Fairness Act; To Extend The Appeal Period For Providers In The Arkansas Medicaid Program; And To Require Comprehensive Information In Notices Of Adverse Decisions.",0,,2025-04-10,"Notification that SB257 is now Act 515",https://legiscan.com/AR/bill/SB257/2025,https://arkleg.state.ar.us/Bills/Detail?id=sb257&ddBienniumSession=2025%2F2025R
1975090,2162,SB258,6,Failed,2025-05-05,"To Create The Arkansas Digital Responsibility, Safety, And Trust Act.","To Create The Arkansas Digital Responsibility, Safety, And Trust Act.",0,,2025-05-05,"Died on Senate Calendar at Sine Die adjournment.",https://legiscan.com/AR/bill/SB258/2025,https://arkleg.state.ar.us/Bills/Detail?id=sb258&ddBienniumSession=2025%2F2025R
1975561,2162,SB259,4,Passed,2025-03-12,"To Transfer Appointment Authority For The Director Of The Arkansas Waterways Commission To The Governor.","To Transfer Appointment Authority For The Director Of The Arkansas Waterways Commission To The Governor.",0,,2025-03-12,"Notification that SB259 is now Act 293",https://legiscan.com/AR/bill/SB259/2025,https://arkleg.state.ar.us/Bills/Detail?id=sb259&ddBienniumSession=2025%2F2025R
1975956,2162,SB260,4,Passed,2025-03-12,"To Amend The Law Concerning The Collection Of Court Fines, Fees, Or Costs After Default.","To Amend The Law Concerning The Collection Of Court Fines, Fees, Or Costs After Default.",0,,2025-03-12,"Notification that SB260 is now Act 277",https://legiscan.com/AR/bill/SB260/2025,https://arkleg.state.ar.us/Bills/Detail?id=sb260&ddBienniumSession=2025%2F2025R
1976252,2162,SB261,6,Failed,2025-05-05,"To Amend The Law Concerning The Operation Of An All-terrain Vehicle On Certain Roads; And To Amend The Law Concerning The Access Of All-terrain Vehicles To Unpaved Roads.","To Amend The Law Concerning The Operation Of An All-terrain Vehicle On Certain Roads; And To Amend The Law Concerning The Access Of All-terrain Vehicles To Unpaved Roads.",0,,2025-05-05,"Died in House Committee at Sine Die adjournment.",https://legiscan.com/AR/bill/SB261/2025,https://arkleg.state.ar.us/Bills/Detail?id=sb261&ddBienniumSession=2025%2F2025R
1976701,2162,SB262,6,Failed,2025-05-05,"To Amend The Corporate Practice Of Medicine Doctrine; And To Authorize A Licensed Medical Professional Who Owns A Medical Corporation To Maintain Ownership Upon An Inactive License Or Retirement.","To Amend The Corporate Practice Of Medicine Doctrine; And To Authorize A Licensed Medical Professional Who Owns A Medical Corporation To Maintain Ownership Upon An Inactive License Or Retirement.",0,,2025-05-05,"Died on House Calendar at Sine Die adjournment.",https://legiscan.com/AR/bill/SB262/2025,https://arkleg.state.ar.us/Bills/Detail?id=sb262&ddBienniumSession=2025%2F2025R
1977003,2162,SB263,4,Passed,2025-03-18,"To Increase The Homestead Property Tax Credit.","To Increase The Homestead Property Tax Credit.",0,,2025-03-18,"Notification that SB263 is now Act 330",https://legiscan.com/AR/bill/SB263/2025,https://arkleg.state.ar.us/Bills/Detail?id=sb263&ddBienniumSession=2025%2F2025R
1976831,2162,SB264,4,Passed,2025-04-09,"To Establish The Arkansas Primary Care Payment Improvement Working Group.","To Establish The Arkansas Primary Care Payment Improvement Working Group.",0,,2025-04-09,"Notification that SB264 is now Act 483",https://legiscan.com/AR/bill/SB264/2025,https://arkleg.state.ar.us/Bills/Detail?id=sb264&ddBienniumSession=2025%2F2025R
1976913,2162,SB265,4,Passed,2025-03-12,"To Reduce And Modify The Membership Of The Licensing Committee Relating To Wastewater And The Licensing Committee Relating To Solid Waste; And To Amend The Apprenticeship Licenses In Solid Waste Licensing.","To Reduce And Modify The Membership Of The Licensing Committee Relating To Wastewater And The Licensing Committee Relating To Solid Waste; And To Amend The Apprenticeship Licenses In Solid Waste Licensing.",0,,2025-03-12,"Notification that SB265 is now Act 294",https://legiscan.com/AR/bill/SB265/2025,https://arkleg.state.ar.us/Bills/Detail?id=sb265&ddBienniumSession=2025%2F2025R
1977391,2162,SB266,6,Failed,2025-05-05,"To Authorize A Public School To Adopt A Policy For One Or More Student Mentors.","To Authorize A Public School To Adopt A Policy For One Or More Student Mentors.",0,,2025-05-05,"Died in Senate Committee at Sine Die adjournment.",https://legiscan.com/AR/bill/SB266/2025,https://arkleg.state.ar.us/Bills/Detail?id=sb266&ddBienniumSession=2025%2F2025R
1977731,2162,SB267,4,Passed,2025-03-12,"To Repeal The Arkansas Alternative Motor Fuel Development Act; And To Repeal The Alternative Motor Fuel Development Fund.","To Repeal The Arkansas Alternative Motor Fuel Development Act; And To Repeal The Alternative Motor Fuel Development Fund.",0,,2025-03-12,"Notification that SB267 is now Act 295",https://legiscan.com/AR/bill/SB267/2025,https://arkleg.state.ar.us/Bills/Detail?id=sb267&ddBienniumSession=2025%2F2025R
1977605,2162,SB268,6,Failed,2025-05-05,"To Transfer General Revenue To The Aging And Adult Services Fund Account To Be Used For Food Services Benefiting The Elderly; And To Declare An Emergency.","To Transfer General Revenue To The Aging And Adult Services Fund Account To Be Used For Food Services Benefiting The Elderly; And To Declare An Emergency.",0,,2025-05-05,"Died in Senate Committee at Sine Die adjournment.",https://legiscan.com/AR/bill/SB268/2025,https://arkleg.state.ar.us/Bills/Detail?id=sb268&ddBienniumSession=2025%2F2025R
1979899,2162,SB269,6,Failed,2025-05-05,"To Amend The Requirements Regarding Locations For And Geographic Areas Of A Hospice Agency.","To Amend The Requirements Regarding Locations For And Geographic Areas Of A Hospice Agency.",0,,2025-05-05,"Died in Senate Committee at Sine Die adjournment.",https://legiscan.com/AR/bill/SB269/2025,https://arkleg.state.ar.us/Bills/Detail?id=sb269&ddBienniumSession=2025%2F2025R
1980801,2162,SB270,4,Passed,2025-03-20,"To Amend The Law Concerning The Filing Periods Of Certain Nonpartisan School Board And Municipal Candidates. ","To Amend The Law Concerning The Filing Periods Of Certain Nonpartisan School Board And Municipal Candidates. ",0,,2025-03-20,"Notification that SB270 is now Act 360",https://legiscan.com/AR/bill/SB270/2025,https://arkleg.state.ar.us/Bills/Detail?id=sb270&ddBienniumSession=2025%2F2025R
1980966,2162,SB271,4,Passed,2025-04-07,"To Amend The Law Concerning A County Clerk&#x27;s Certification Of School Board Candidates To The County Board Of Election Commissioners. ","To Amend The Law Concerning A County Clerk&#x27;s Certification Of School Board Candidates To The County Board Of Election Commissioners. ",0,,2025-04-07,"Notification that SB271 is now Act 460",https://legiscan.com/AR/bill/SB271/2025,https://arkleg.state.ar.us/Bills/Detail?id=sb271&ddBienniumSession=2025%2F2025R
1981073,2162,SB272,4,Passed,2025-03-12,"To Amend The Law Concerning Voter Registration; To Prohibit Pre-filled Fields On A Voter Registration Form In Certain Instances; And To Amend Provisions Of Arkansas Constitution, Amendment 51, &#xa7; 6.","To Amend The Law Concerning Voter Registration; To Prohibit Pre-filled Fields On A Voter Registration Form In Certain Instances; And To Amend Provisions Of Arkansas Constitution, Amendment 51, &#xa7; 6.",0,,2025-03-12,"Notification that SB272 is now Act 278",https://legiscan.com/AR/bill/SB272/2025,https://arkleg.state.ar.us/Bills/Detail?id=sb272&ddBienniumSession=2025%2F2025R
1980912,2162,SB273,6,Failed,2025-05-05,"To Require Dialysis Centers To Have A Backup Generator On Site.","To Require Dialysis Centers To Have A Backup Generator On Site.",0,,2025-05-05,"Died in Senate Committee at Sine Die adjournment.",https://legiscan.com/AR/bill/SB273/2025,https://arkleg.state.ar.us/Bills/Detail?id=sb273&ddBienniumSession=2025%2F2025R
1981706,2162,SB274,6,Failed,2025-05-05,"To Create A Sales And Use Tax Exemption For Certain Items Related To Human Burial; And To Exempt A Portion Of The Purchase Price Of A Casket, Burial Vault, Or Monument From Sales And Use Tax.","To Create A Sales And Use Tax Exemption For Certain Items Related To Human Burial; And To Exempt A Portion Of The Purchase Price Of A Casket, Burial Vault, Or Monument From Sales And Use Tax.",0,,2025-05-05,"Died in Senate Committee at Sine Die adjournment.",https://legiscan.com/AR/bill/SB274/2025,https://arkleg.state.ar.us/Bills/Detail?id=sb274&ddBienniumSession=2025%2F2025R
1981333,2162,SB275,4,Passed,2025-04-07,"To Amend The Law Concerning The Regulation Of Liquefied Petroleum Gases.","To Amend The Law Concerning The Regulation Of Liquefied Petroleum Gases.",0,,2025-04-07,"Notification that SB275 is now Act 441",https://legiscan.com/AR/bill/SB275/2025,https://arkleg.state.ar.us/Bills/Detail?id=sb275&ddBienniumSession=2025%2F2025R
1981482,2162,SB276,4,Passed,2025-03-20,"To Amend The Law Concerning Surplus Lines Insurance; And To Clarify That Surplus Lines Insurance Is Acceptable Coverage For Financial Responsibility Of Motor Vehicle Insurance Coverage.","To Amend The Law Concerning Surplus Lines Insurance; And To Clarify That Surplus Lines Insurance Is Acceptable Coverage For Financial Responsibility Of Motor Vehicle Insurance Coverage.",0,,2025-03-20,"Notification that SB276 is now Act 345",https://legiscan.com/AR/bill/SB276/2025,https://arkleg.state.ar.us/Bills/Detail?id=sb276&ddBienniumSession=2025%2F2025R
1981282,2162,SB277,6,Failed,2025-05-05,"To Amend The Comprehensive Criminal Record Sealing Act Of 2013; And To Permit The Filing Of A New Uniform Petition To Seal A Misdemeanor Violation Of Theft Of Property After Ten Years Have Elapsed Since The Theft.","To Amend The Comprehensive Criminal Record Sealing Act Of 2013; And To Permit The Filing Of A New Uniform Petition To Seal A Misdemeanor Violation Of Theft Of Property After Ten Years Have Elapsed Since The Theft.",0,,2025-05-05,"Died in House Committee at Sine Die adjournment.",https://legiscan.com/AR/bill/SB277/2025,https://arkleg.state.ar.us/Bills/Detail?id=sb277&ddBienniumSession=2025%2F2025R
1981435,2162,SB278,4,Passed,2025-04-08,"To Repeal The Statutes Concerning The Occupational Authorization And Licensure Of Certain Employment Offices And Agencies; And To Repeal The Arkansas Private Employment Agency Act Of 1975.","To Repeal The Statutes Concerning The Occupational Authorization And Licensure Of Certain Employment Offices And Agencies; And To Repeal The Arkansas Private Employment Agency Act Of 1975.",0,,2025-04-08,"Notification that SB278 is now Act 438",https://legiscan.com/AR/bill/SB278/2025,https://arkleg.state.ar.us/Bills/Detail?id=sb278&ddBienniumSession=2025%2F2025R
1981685,2162,SB279,4,Passed,2025-03-31,"To Assist The Division Of Labor With Enforcing The Fair And Prompt Payment Of Wages To Arkansas Citizens; And To Clarify The Manner In Which Wage And Hour Complaints Are Investigated.","To Assist The Division Of Labor With Enforcing The Fair And Prompt Payment Of Wages To Arkansas Citizens; And To Clarify The Manner In Which Wage And Hour Complaints Are Investigated.",0,,2025-03-31,"Notification that SB279 is now Act 397",https://legiscan.com/AR/bill/SB279/2025,https://arkleg.state.ar.us/Bills/Detail?id=sb279&ddBienniumSession=2025%2F2025R
1981233,2162,SB280,4,Passed,2025-04-07,"To Designate The Oil And Gas Commission As The Custodian Of All Property And The Disbursing Agent Of All Funds Of The Office Of The State Geologist.","To Designate The Oil And Gas Commission As The Custodian Of All Property And The Disbursing Agent Of All Funds Of The Office Of The State Geologist.",0,,2025-04-07,"Notification that SB280 is now Act 442",https://legiscan.com/AR/bill/SB280/2025,https://arkleg.state.ar.us/Bills/Detail?id=sb280&ddBienniumSession=2025%2F2025R
1981507,2162,SB281,6,Failed,2025-05-05,"To Amend The Law Regarding Agriculture; To Establish The Producer Bill Of Rights For Commodity Checkoff Programs Act; And To Require Certain Actions Related To Commodity Checkoff Programs.","To Amend The Law Regarding Agriculture; To Establish The Producer Bill Of Rights For Commodity Checkoff Programs Act; And To Require Certain Actions Related To Commodity Checkoff Programs.",0,,2025-05-05,"Died in Senate Committee at Sine Die adjournment.",https://legiscan.com/AR/bill/SB281/2025,https://arkleg.state.ar.us/Bills/Detail?id=sb281&ddBienniumSession=2025%2F2025R
1981923,2162,SB282,6,Failed,2025-05-05,"Amending The Law Concerning Public Water Systems; And To Allow Voters To Elect &quot;for&quot; Or &quot;against&quot; Water Fluoridation. ","Amending The Law Concerning Public Water Systems; And To Allow Voters To Elect &quot;for&quot; Or &quot;against&quot; Water Fluoridation. ",0,,2025-05-05,"Died on Senate Calendar at Sine Die adjournment.",https://legiscan.com/AR/bill/SB282/2025,https://arkleg.state.ar.us/Bills/Detail?id=sb282&ddBienniumSession=2025%2F2025R
1981969,2162,SB283,1,Introduced,2025-02-24,"To Amend The Law Concerning Unclaimed Property; And To Provide That Certain Nonprofit Organizations Are Exempt From The Law Concerning Unclaimed Property.","To Amend The Law Concerning Unclaimed Property; And To Provide That Certain Nonprofit Organizations Are Exempt From The Law Concerning Unclaimed Property.",0,,2025-05-05,"Sine Die adjournment",https://legiscan.com/AR/bill/SB283/2025,https://arkleg.state.ar.us/Bills/Detail?id=sb283&ddBienniumSession=2025%2F2025R
1981809,2162,SB284,1,Introduced,2025-02-24,"To Modify The Employer&#x27;s Liability Under The Workers&#x27; Compensation Law That Resulted From Initiated Measure 1948, No. 4.","To Modify The Employer&#x27;s Liability Under The Workers&#x27; Compensation Law That Resulted From Initiated Measure 1948, No. 4.",0,,2025-05-05,"Sine Die adjournment",https://legiscan.com/AR/bill/SB284/2025,https://arkleg.state.ar.us/Bills/Detail?id=sb284&ddBienniumSession=2025%2F2025R
1981830,2162,SB285,1,Introduced,2025-02-24,"To Modify The Compensation Restrictions Under The Workers&#x27; Compensation Law That Resulted From Initiated Act 4 Of 1948.","To Modify The Compensation Restrictions Under The Workers&#x27; Compensation Law That Resulted From Initiated Act 4 Of 1948.",0,,2025-05-05,"Sine Die adjournment",https://legiscan.com/AR/bill/SB285/2025,https://arkleg.state.ar.us/Bills/Detail?id=sb285&ddBienniumSession=2025%2F2025R
1981785,2162,SB286,1,Introduced,2025-02-24,"To Allow Additional Wage Loss Benefits In Addition To Scheduled Injury Payments Under The Workers&#x27; Compensation Law That Resulted From Initiated Measure 1948, No. 4.","To Allow Additional Wage Loss Benefits In Addition To Scheduled Injury Payments Under The Workers&#x27; Compensation Law That Resulted From Initiated Measure 1948, No. 4.",0,,2025-05-05,"Sine Die adjournment",https://legiscan.com/AR/bill/SB286/2025,https://arkleg.state.ar.us/Bills/Detail?id=sb286&ddBienniumSession=2025%2F2025R
1981763,2162,SB287,1,Introduced,2025-02-24,"To Modify Certain Attorney Fees For Controverted Medical Expenses, Appeals, And Changes Of Physicians Under The Workers&#x27; Compensation Law That Resulted From Initiated Measure 1948, No. 4.","To Modify Certain Attorney Fees For Controverted Medical Expenses, Appeals, And Changes Of Physicians Under The Workers&#x27; Compensation Law That Resulted From Initiated Measure 1948, No. 4.",0,,2025-05-05,"Sine Die adjournment",https://legiscan.com/AR/bill/SB287/2025,https://arkleg.state.ar.us/Bills/Detail?id=sb287&ddBienniumSession=2025%2F2025R
1981741,2162,SB288,1,Introduced,2025-02-24,"To Modify A Physician Change Under The Workers&#x27; Compensation Law That Resulted From Initiated Measure 1948, No. 4.","To Modify A Physician Change Under The Workers&#x27; Compensation Law That Resulted From Initiated Measure 1948, No. 4.",0,,2025-05-05,"Sine Die adjournment",https://legiscan.com/AR/bill/SB288/2025,https://arkleg.state.ar.us/Bills/Detail?id=sb288&ddBienniumSession=2025%2F2025R
1982011,2162,SB289,6,Failed,2025-05-05,"To Cut The Statewide Sales Tax Rate By One-eighth Percent To Reduce The Surplus Funds Collected From Arkansas Taxpayers.","To Cut The Statewide Sales Tax Rate By One-eighth Percent To Reduce The Surplus Funds Collected From Arkansas Taxpayers.",0,,2025-05-05,"Died in Senate Committee at Sine Die adjournment.",https://legiscan.com/AR/bill/SB289/2025,https://arkleg.state.ar.us/Bills/Detail?id=sb289&ddBienniumSession=2025%2F2025R
1982672,2162,SB290,4,Passed,2025-04-22,"To Prohibit A Moratorium On The Issuance Of Permits In Watersheds And Other Bodies Of Water.","To Prohibit A Moratorium On The Issuance Of Permits In Watersheds And Other Bodies Of Water.",0,,2025-04-22,"Notification that SB290 is now Act 921",https://legiscan.com/AR/bill/SB290/2025,https://arkleg.state.ar.us/Bills/Detail?id=sb290&ddBienniumSession=2025%2F2025R
1982708,2162,SB291,4,Passed,2025-03-12,"To Amend The Law Concerning Complaints Of Election Law Violations; And To Amend The Deadlines For Complaints Of Election Law Violations. ","To Amend The Law Concerning Complaints Of Election Law Violations; And To Amend The Deadlines For Complaints Of Election Law Violations. ",0,,2025-03-12,"Notification that SB291 is now Act 279",https://legiscan.com/AR/bill/SB291/2025,https://arkleg.state.ar.us/Bills/Detail?id=sb291&ddBienniumSession=2025%2F2025R
1982479,2162,SB292,4,Passed,2025-03-12,"To Amend The Law Concerning The Date Of An Annual School Election; To Move The Annual School Election If The Annual School Election Is Scheduled On A State Holiday In Certain Instances; And To Declare An Emergency. ","To Amend The Law Concerning The Date Of An Annual School Election; To Move The Annual School Election If The Annual School Election Is Scheduled On A State Holiday In Certain Instances; And To Declare An Emergency. ",0,,2025-03-12,"Notification that SB292 is now Act 264",https://legiscan.com/AR/bill/SB292/2025,https://arkleg.state.ar.us/Bills/Detail?id=sb292&ddBienniumSession=2025%2F2025R
1982519,2162,SB293,4,Passed,2025-04-09,"To Amend The Law Concerning The Required Postings At A Polling Site; And To Amend The List Concerning Required Posting Of Notices, Information, And Material At A Polling Site On Election Day.","To Amend The Law Concerning The Required Postings At A Polling Site; And To Amend The List Concerning Required Posting Of Notices, Information, And Material At A Polling Site On Election Day.",0,,2025-04-09,"Notification that SB293 is now Act 487",https://legiscan.com/AR/bill/SB293/2025,https://arkleg.state.ar.us/Bills/Detail?id=sb293&ddBienniumSession=2025%2F2025R
1982292,2162,SB294,4,Passed,2025-03-12,"To Amend The Law Concerning Election Audits; And To Allow The State Board Of Election Commissioners To Audit A County In The Preceding Election In Certain Circumstances. ","To Amend The Law Concerning Election Audits; And To Allow The State Board Of Election Commissioners To Audit A County In The Preceding Election In Certain Circumstances. ",0,,2025-03-12,"Notification that SB294 is now Act 280",https://legiscan.com/AR/bill/SB294/2025,https://arkleg.state.ar.us/Bills/Detail?id=sb294&ddBienniumSession=2025%2F2025R
1982596,2162,SB295,4,Passed,2025-03-12,"To Amend The Law Concerning Appropriation For Election Expenses; And To Allow Compensation For A Certified Election Monitor As An Election Expense. ","To Amend The Law Concerning Appropriation For Election Expenses; And To Allow Compensation For A Certified Election Monitor As An Election Expense. ",0,,2025-03-12,"Notification that SB295 is now Act 281",https://legiscan.com/AR/bill/SB295/2025,https://arkleg.state.ar.us/Bills/Detail?id=sb295&ddBienniumSession=2025%2F2025R
1982403,2162,SB296,4,Passed,2025-03-12,"To Amend The Law Concerning The Designation Of An Early Voting Location By The County Clerk.","To Amend The Law Concerning The Designation Of An Early Voting Location By The County Clerk.",0,,2025-03-12,"Notification that SB296 is now Act 282",https://legiscan.com/AR/bill/SB296/2025,https://arkleg.state.ar.us/Bills/Detail?id=sb296&ddBienniumSession=2025%2F2025R
1982741,2162,SB297,4,Passed,2025-03-12,"To Amend The Law Concerning Municipalities Choosing To Elect Council Members; And To Require Filing Of The Ordinance Describing The Election Of City Council Members With The County Clerk.","To Amend The Law Concerning Municipalities Choosing To Elect Council Members; And To Require Filing Of The Ordinance Describing The Election Of City Council Members With The County Clerk.",0,,2025-03-12,"Notification that SB297 is now Act 283",https://legiscan.com/AR/bill/SB297/2025,https://arkleg.state.ar.us/Bills/Detail?id=sb297&ddBienniumSession=2025%2F2025R
1982631,2162,SB298,4,Passed,2025-03-18,"To Repeal The Law Concerning The Setting Aside Of A Decree To Quiet Title To Land To Allow For Finality In Quiet Title Actions.","To Repeal The Law Concerning The Setting Aside Of A Decree To Quiet Title To Land To Allow For Finality In Quiet Title Actions.",0,,2025-03-18,"Notification that SB298 is now Act 320",https://legiscan.com/AR/bill/SB298/2025,https://arkleg.state.ar.us/Bills/Detail?id=sb298&ddBienniumSession=2025%2F2025R
1983329,2162,SB299,4,Passed,2025-03-31,"To Require A Staff Member To Witness An Administrator Assisting A Resident Of A Long-term Residential Care Facility With Absentee Voting.","To Require A Staff Member To Witness An Administrator Assisting A Resident Of A Long-term Residential Care Facility With Absentee Voting.",0,,2025-03-31,"Notification that SB299 is now Act 403",https://legiscan.com/AR/bill/SB299/2025,https://arkleg.state.ar.us/Bills/Detail?id=sb299&ddBienniumSession=2025%2F2025R
1983502,2162,SB300,4,Passed,2025-03-18,"To Create The Criminal Offense Of Organized Retail Theft.","To Create The Criminal Offense Of Organized Retail Theft.",0,,2025-03-18,"Notification that SB300 is now Act 321",https://legiscan.com/AR/bill/SB300/2025,https://arkleg.state.ar.us/Bills/Detail?id=sb300&ddBienniumSession=2025%2F2025R
1983120,2162,SB301,4,Passed,2025-03-18,"To Amend The Law Concerning Theft Of Property; To Create An Enhanced Penalty For Theft Of Cargo; And To Declare An Emergency.","To Amend The Law Concerning Theft Of Property; To Create An Enhanced Penalty For Theft Of Cargo; And To Declare An Emergency.",0,,2025-03-18,"Notification that SB301 is now Act 322",https://legiscan.com/AR/bill/SB301/2025,https://arkleg.state.ar.us/Bills/Detail?id=sb301&ddBienniumSession=2025%2F2025R
1982814,2162,SB302,4,Passed,2025-04-18,"To Create The Criminal Offense Of Gift Card Fraud; And To Declare An Emergency.","To Create The Criminal Offense Of Gift Card Fraud; And To Declare An Emergency.",0,,2025-04-18,"Notification that SB302 is now Act 659",https://legiscan.com/AR/bill/SB302/2025,https://arkleg.state.ar.us/Bills/Detail?id=sb302&ddBienniumSession=2025%2F2025R
1983291,2162,SB303,4,Passed,2025-04-18,"To Allow A Resident School District To Permit A Private School Student To Participate In An Interscholastic Activity At The Resident School District Under Certain Conditions.","To Allow A Resident School District To Permit A Private School Student To Participate In An Interscholastic Activity At The Resident School District Under Certain Conditions.",0,,2025-04-18,"Notification that SB303 is now Act 644",https://legiscan.com/AR/bill/SB303/2025,https://arkleg.state.ar.us/Bills/Detail?id=sb303&ddBienniumSession=2025%2F2025R
1982847,2162,SB304,4,Passed,2025-03-20,"To Allow A Class Of Registered Voters That Have Changed Their County Of Residence To Cast A Valid Ballot; And To Amend Provisions Of Arkansas Constitution, Amendment 51. ","To Allow A Class Of Registered Voters That Have Changed Their County Of Residence To Cast A Valid Ballot; And To Amend Provisions Of Arkansas Constitution, Amendment 51. ",0,,2025-03-20,"Notification that SB304 is now Act 372",https://legiscan.com/AR/bill/SB304/2025,https://arkleg.state.ar.us/Bills/Detail?id=sb304&ddBienniumSession=2025%2F2025R
1983190,2162,SB305,4,Passed,2025-04-09,"To Require Certain Testing Of Processed Marijuana Products Sold As Medical Marijuana.","To Require Certain Testing Of Processed Marijuana Products Sold As Medical Marijuana.",0,,2025-04-09,"Notification that SB305 is now Act 491",https://legiscan.com/AR/bill/SB305/2025,https://arkleg.state.ar.us/Bills/Detail?id=sb305&ddBienniumSession=2025%2F2025R
1983606,2162,SB306,6,Failed,2025-05-05,"To Require The Department Of Human Services To Apply For A Home- And Community-based Services Waiver For The Aging And Elderly Population In This State.","To Require The Department Of Human Services To Apply For A Home- And Community-based Services Waiver For The Aging And Elderly Population In This State.",0,,2025-05-05,"Died in Senate Committee at Sine Die adjournment.",https://legiscan.com/AR/bill/SB306/2025,https://arkleg.state.ar.us/Bills/Detail?id=sb306&ddBienniumSession=2025%2F2025R
