bill_id,session_id,bill_number,status,status_desc,status_date,title,description,committee_id,committee,last_action_date,last_action,url,state_link
1969736,2162,HB1480,1,Introduced,2025-02-13,"To Amend The Arkansas Academic Challenge Scholarship Program; And To Amend The Definition Of &quot;approved Institution Of Higher Education&quot;.","To Amend The Arkansas Academic Challenge Scholarship Program; And To Amend The Definition Of &quot;approved Institution Of Higher Education&quot;.",0,,2025-03-18,"WITHDRAWN BY AUTHOR",https://legiscan.com/AR/bill/HB1480/2025,https://arkleg.state.ar.us/Bills/Detail?id=hb1480&ddBienniumSession=2025%2F2025R
1969349,2162,HB1481,6,Failed,2025-05-05,"To Create The Anti-atf Commandeering Act; And To Prohibit The Provision Of Material Aid And Support For Enforcement Of Federal Firearms Laws.","To Create The Anti-atf Commandeering Act; And To Prohibit The Provision Of Material Aid And Support For Enforcement Of Federal Firearms Laws.",0,,2025-05-05,"Died in House Committee at Sine Die adjournment.",https://legiscan.com/AR/bill/HB1481/2025,https://arkleg.state.ar.us/Bills/Detail?id=hb1481&ddBienniumSession=2025%2F2025R
1968977,2162,HB1482,6,Failed,2025-05-05,"To Create An Exception To The School Attendance Requirements For A Student Who Takes A Ged Test And Receives A Ged.","To Create An Exception To The School Attendance Requirements For A Student Who Takes A Ged Test And Receives A Ged.",0,,2025-05-05,"Died in House Committee at Sine Die adjournment.",https://legiscan.com/AR/bill/HB1482/2025,https://arkleg.state.ar.us/Bills/Detail?id=hb1482&ddBienniumSession=2025%2F2025R
1969081,2162,HB1483,6,Failed,2025-05-05,"To Allow A Public School District To Use State Funds To Pay For An Adult Education Program With Which It Contracts.","To Allow A Public School District To Use State Funds To Pay For An Adult Education Program With Which It Contracts.",0,,2025-05-05,"Died in Senate Committee at Sine Die adjournment.",https://legiscan.com/AR/bill/HB1483/2025,https://arkleg.state.ar.us/Bills/Detail?id=hb1483&ddBienniumSession=2025%2F2025R
1969568,2162,HB1484,4,Passed,2025-04-21,"To Limit The Number Of Credits A Student May Obtain In A Course Credit Recovery Program.","To Limit The Number Of Credits A Student May Obtain In A Course Credit Recovery Program.",0,,2025-04-21,"Notification that HB1484 is now Act 910",https://legiscan.com/AR/bill/HB1484/2025,https://arkleg.state.ar.us/Bills/Detail?id=hb1484&ddBienniumSession=2025%2F2025R
1969459,2162,HB1485,6,Failed,2025-05-05,"To Create A Sales And Use Tax Exemption For Sales To Certain Organizations That Support Veterans&#x27; Facilities.","To Create A Sales And Use Tax Exemption For Sales To Certain Organizations That Support Veterans&#x27; Facilities.",0,,2025-05-05,"Died in Senate Committee at Sine Die adjournment.",https://legiscan.com/AR/bill/HB1485/2025,https://arkleg.state.ar.us/Bills/Detail?id=hb1485&ddBienniumSession=2025%2F2025R
1969793,2162,HB1486,4,Passed,2025-02-27,"To Amend The Law Concerning The Market Value Of Certain Surplus Property Acquired By The State Highway Commission.","To Amend The Law Concerning The Market Value Of Certain Surplus Property Acquired By The State Highway Commission.",0,,2025-02-27,"Notification that HB1486 is now Act 210",https://legiscan.com/AR/bill/HB1486/2025,https://arkleg.state.ar.us/Bills/Detail?id=hb1486&ddBienniumSession=2025%2F2025R
1970212,2162,HB1487,4,Passed,2025-02-27,"To Amend The Number Of Commissioners On The Arkansas Forestry Commission&#x27;s Committee.","To Amend The Number Of Commissioners On The Arkansas Forestry Commission&#x27;s Committee.",0,,2025-02-27,"Notification that HB1487 is now Act 212",https://legiscan.com/AR/bill/HB1487/2025,https://arkleg.state.ar.us/Bills/Detail?id=hb1487&ddBienniumSession=2025%2F2025R
1971010,2162,HB1488,4,Passed,2025-03-25,"To Amend The Standard Nonforfeiture Law For Life Insurance; And To Require An Insurer To Pay Interest On Deferred Payment Of Any Cash Surrender Value Under Certain Policies.","To Amend The Standard Nonforfeiture Law For Life Insurance; And To Require An Insurer To Pay Interest On Deferred Payment Of Any Cash Surrender Value Under Certain Policies.",0,,2025-03-25,"Notification that HB1488 is now Act 391",https://legiscan.com/AR/bill/HB1488/2025,https://arkleg.state.ar.us/Bills/Detail?id=hb1488&ddBienniumSession=2025%2F2025R
1970670,2162,HB1489,4,Passed,2025-03-18,"To Amend The Method Of Execution To Include Nitrogen Gas.","To Amend The Method Of Execution To Include Nitrogen Gas.",0,,2025-03-18,"Notification that HB1489 is now Act 302",https://legiscan.com/AR/bill/HB1489/2025,https://arkleg.state.ar.us/Bills/Detail?id=hb1489&ddBienniumSession=2025%2F2025R
1970756,2162,HB1490,6,Failed,2025-05-05,"To Repeal The Requirement That A Public School Student Return Temporarily Issued Items, Resources, Materials, And Property Belonging To A Public School In Order To Be Eligible To Enroll In A Home School.","To Repeal The Requirement That A Public School Student Return Temporarily Issued Items, Resources, Materials, And Property Belonging To A Public School In Order To Be Eligible To Enroll In A Home School.",0,,2025-05-05,"Died in House Committee at Sine Die adjournment.",https://legiscan.com/AR/bill/HB1490/2025,https://arkleg.state.ar.us/Bills/Detail?id=hb1490&ddBienniumSession=2025%2F2025R
1970926,2162,HB1491,4,Passed,2025-04-17,"Concerning The Excise Tax On Certain Beer And Sake; To Create An Excise Tax Credit For Certain Beer And Sake Produced Using Arkansas Rice; And For Other Purposes.","Concerning The Excise Tax On Certain Beer And Sake; To Create An Excise Tax Credit For Certain Beer And Sake Produced Using Arkansas Rice; And For Other Purposes.",0,,2025-04-17,"Notification that HB1491 is now Act 874",https://legiscan.com/AR/bill/HB1491/2025,https://arkleg.state.ar.us/Bills/Detail?id=hb1491&ddBienniumSession=2025%2F2025R
1971967,2162,HB1492,1,Introduced,2025-02-17,"To Require Each Public School District And Open-enrollment Public Charter School To Implement A Mobile Panic Alert System.","To Require Each Public School District And Open-enrollment Public Charter School To Implement A Mobile Panic Alert System.",0,,2025-04-16,"Recommended for study in the Interim by the Committee on",https://legiscan.com/AR/bill/HB1492/2025,https://arkleg.state.ar.us/Bills/Detail?id=hb1492&ddBienniumSession=2025%2F2025R
1972208,2162,HB1493,4,Passed,2025-03-12,"An Act For The Institutions Of Higher Education Capital Improvement Appropriation.","An Act For The Institutions Of Higher Education Capital Improvement Appropriation.",0,,2025-03-12,"Notification that HB1493 is now Act 298",https://legiscan.com/AR/bill/HB1493/2025,https://arkleg.state.ar.us/Bills/Detail?id=hb1493&ddBienniumSession=2025%2F2025R
1972355,2162,HB1494,6,Failed,2025-05-05,"To Create The Arkansas Guidance Out Of The Darkness Act; And To Require State Agencies To Publish Federal Guidance Documents Online.","To Create The Arkansas Guidance Out Of The Darkness Act; And To Require State Agencies To Publish Federal Guidance Documents Online.",0,,2025-05-05,"Died in House Committee at Sine Die adjournment.",https://legiscan.com/AR/bill/HB1494/2025,https://arkleg.state.ar.us/Bills/Detail?id=hb1494&ddBienniumSession=2025%2F2025R
1972130,2162,HB1495,6,Failed,2025-05-05,"Concerning The Transfer Of A Student&#x27;s Permanent School Record.","Concerning The Transfer Of A Student&#x27;s Permanent School Record.",0,,2025-05-05,"Died in Senate Committee at Sine Die adjournment.",https://legiscan.com/AR/bill/HB1495/2025,https://arkleg.state.ar.us/Bills/Detail?id=hb1495&ddBienniumSession=2025%2F2025R
1972543,2162,HB1496,4,Passed,2025-03-18,"To Amend Provisions Of The Arkansas Code To Ensure Arkansas Students Are Taught By Qualified Teachers.","To Amend Provisions Of The Arkansas Code To Ensure Arkansas Students Are Taught By Qualified Teachers.",0,,2025-03-18,"Notification that HB1496 is now Act 304",https://legiscan.com/AR/bill/HB1496/2025,https://arkleg.state.ar.us/Bills/Detail?id=hb1496&ddBienniumSession=2025%2F2025R
1972109,2162,HB1497,4,Passed,2025-03-25,"To Add The Department Of The Military To The List Of Claimant Agencies For Purposes Of The Setoff Against State Tax Refunds; And To Amend The Definition Of &quot;debt&quot; For Purposes Of The Setoff Against State Tax Refunds.","To Add The Department Of The Military To The List Of Claimant Agencies For Purposes Of The Setoff Against State Tax Refunds; And To Amend The Definition Of &quot;debt&quot; For Purposes Of The Setoff Against State Tax Refunds.",0,,2025-03-25,"Notification that HB1497 is now Act 411",https://legiscan.com/AR/bill/HB1497/2025,https://arkleg.state.ar.us/Bills/Detail?id=hb1497&ddBienniumSession=2025%2F2025R
1972308,2162,HB1498,4,Passed,2025-04-10,"To Amend The Law Concerning Military-type Canteens And Exchanges.","To Amend The Law Concerning Military-type Canteens And Exchanges.",0,,2025-04-10,"Notification that HB1498 is now Act 507",https://legiscan.com/AR/bill/HB1498/2025,https://arkleg.state.ar.us/Bills/Detail?id=hb1498&ddBienniumSession=2025%2F2025R
1972458,2162,HB1499,4,Passed,2025-03-12,"To Amend The Sale And Purchase Procedure For Public Property.","To Amend The Sale And Purchase Procedure For Public Property.",0,,2025-03-12,"Notification that HB1499 is now Act 288",https://legiscan.com/AR/bill/HB1499/2025,https://arkleg.state.ar.us/Bills/Detail?id=hb1499&ddBienniumSession=2025%2F2025R
1972329,2162,HB1500,6,Failed,2025-05-05,"To Enhance Economic Competitiveness By Repealing The Throwback Rule.","To Enhance Economic Competitiveness By Repealing The Throwback Rule.",0,,2025-05-05,"Died in House Committee at Sine Die adjournment.",https://legiscan.com/AR/bill/HB1500/2025,https://arkleg.state.ar.us/Bills/Detail?id=hb1500&ddBienniumSession=2025%2F2025R
1972228,2162,HB1501,6,Failed,2025-05-05,"To Adopt Federal Income Tax Law Regarding Depreciation And The Expensing Of Property; And To Increase The Amount Allowed For The Expensing Of Certain Depreciable Business Assets To The Amount Allowed Under Federal Law.","To Adopt Federal Income Tax Law Regarding Depreciation And The Expensing Of Property; And To Increase The Amount Allowed For The Expensing Of Certain Depreciable Business Assets To The Amount Allowed Under Federal Law.",0,,2025-05-05,"Died in House Committee at Sine Die adjournment.",https://legiscan.com/AR/bill/HB1501/2025,https://arkleg.state.ar.us/Bills/Detail?id=hb1501&ddBienniumSession=2025%2F2025R
1972269,2162,HB1502,4,Passed,2025-03-18,"To Amend The Law Concerning The Registration And Licensing Of A Historic Or Special Interest Vehicle; And To Amend The Law Concerning Antique Motor Vehicle Special License Plates.","To Amend The Law Concerning The Registration And Licensing Of A Historic Or Special Interest Vehicle; And To Amend The Law Concerning Antique Motor Vehicle Special License Plates.",0,,2025-03-18,"Notification that HB1502 is now Act 325",https://legiscan.com/AR/bill/HB1502/2025,https://arkleg.state.ar.us/Bills/Detail?id=hb1502&ddBienniumSession=2025%2F2025R
1972582,2162,HB1503,4,Passed,2025-03-18,"To Amend The Law Concerning Municipal Regulations; And To Prohibit Certain Restrictions On The Regulation Of Accessory Dwelling Units. ","To Amend The Law Concerning Municipal Regulations; And To Prohibit Certain Restrictions On The Regulation Of Accessory Dwelling Units. ",0,,2025-03-18,"Notification that HB1503 is now Act 313",https://legiscan.com/AR/bill/HB1503/2025,https://arkleg.state.ar.us/Bills/Detail?id=hb1503&ddBienniumSession=2025%2F2025R
1972289,2162,HB1504,6,Failed,2025-05-05,"To Create The Offense Of Manufacturing, Modifying, Selling, Transferring, Or Operating A Robotic Device Or An Uncrewed Aircraft That Is Equipped Or Mounted With A Weapon.","To Create The Offense Of Manufacturing, Modifying, Selling, Transferring, Or Operating A Robotic Device Or An Uncrewed Aircraft That Is Equipped Or Mounted With A Weapon.",0,,2025-05-05,"Died on House Calendar at Sine Die adjournment.",https://legiscan.com/AR/bill/HB1504/2025,https://arkleg.state.ar.us/Bills/Detail?id=hb1504&ddBienniumSession=2025%2F2025R
1972415,2162,HB1505,4,Passed,2025-03-25,"To Require A Public Employer To Offer And Provide Coverage For Licensed Counseling For A Public Safety Employee Who Has Experienced A Traumatic Event; And To Declare An Emergency.","To Require A Public Employer To Offer And Provide Coverage For Licensed Counseling For A Public Safety Employee Who Has Experienced A Traumatic Event; And To Declare An Emergency.",0,,2025-03-25,"Notification that HB1505 is now Act 398",https://legiscan.com/AR/bill/HB1505/2025,https://arkleg.state.ar.us/Bills/Detail?id=hb1505&ddBienniumSession=2025%2F2025R
1972437,2162,HB1506,1,Introduced,2025-02-17,"To Amend The Law Concerning Public Officers And Employees; And To Prohibit A Public Employer From Deducting Labor Organization Membership Dues From The Compensation Of A Public Employee.","To Amend The Law Concerning Public Officers And Employees; And To Prohibit A Public Employer From Deducting Labor Organization Membership Dues From The Compensation Of A Public Employee.",0,,2025-04-01,"WITHDRAWN BY AUTHOR",https://legiscan.com/AR/bill/HB1506/2025,https://arkleg.state.ar.us/Bills/Detail?id=hb1506&ddBienniumSession=2025%2F2025R
1972248,2162,HB1507,4,Passed,2025-03-06,"To Amend The Law Concerning Environmental, Social Justice, Or Governance Scores; And To Clarify The Exemptions From Divestment For Certain Investments.","To Amend The Law Concerning Environmental, Social Justice, Or Governance Scores; And To Clarify The Exemptions From Divestment For Certain Investments.",0,,2025-03-06,"Notification that HB1507 is now Act 252",https://legiscan.com/AR/bill/HB1507/2025,https://arkleg.state.ar.us/Bills/Detail?id=hb1507&ddBienniumSession=2025%2F2025R
1972479,2162,HB1508,4,Passed,2025-03-25,"To Recodify Title 19 Of The Arkansas Code Concerning Public Finance; And To Amend Laws Resulting From Initiated Acts 2000, No. 1; And To Make Conforming Changes To The Arkansas Code.","To Recodify Title 19 Of The Arkansas Code Concerning Public Finance; And To Amend Laws Resulting From Initiated Acts 2000, No. 1; And To Make Conforming Changes To The Arkansas Code.",0,,2025-03-25,"Notification that HB1508 is now Act 419",https://legiscan.com/AR/bill/HB1508/2025,https://arkleg.state.ar.us/Bills/Detail?id=hb1508&ddBienniumSession=2025%2F2025R
1972168,2162,HB1509,4,Passed,2025-04-03,"To Create The Second Amendment Financial Privacy Act; And To Prohibit Financial Institutions From Using Certain Discriminatory Practices.","To Create The Second Amendment Financial Privacy Act; And To Prohibit Financial Institutions From Using Certain Discriminatory Practices.",0,,2025-04-03,"Notification that HB1509 is now Act 452",https://legiscan.com/AR/bill/HB1509/2025,https://arkleg.state.ar.us/Bills/Detail?id=hb1509&ddBienniumSession=2025%2F2025R
1972728,2162,HB1510,4,Passed,2025-03-18,"To Repeal The Authority For A Municipality To Exercise Territorial Jurisdiction Over An Unincorporated Area Of A County.","To Repeal The Authority For A Municipality To Exercise Territorial Jurisdiction Over An Unincorporated Area Of A County.",0,,2025-03-18,"Notification that HB1510 is now Act 314",https://legiscan.com/AR/bill/HB1510/2025,https://arkleg.state.ar.us/Bills/Detail?id=hb1510&ddBienniumSession=2025%2F2025R
1972785,2162,HB1511,1,Introduced,2025-02-17,"To Amend The Law Concerning The Attorney General; And To Amend The Law Concerning The Attorney General&#x27;s Subpoena Power.","To Amend The Law Concerning The Attorney General; And To Amend The Law Concerning The Attorney General&#x27;s Subpoena Power.",0,,2025-03-20,"WITHDRAWN BY AUTHOR",https://legiscan.com/AR/bill/HB1511/2025,https://arkleg.state.ar.us/Bills/Detail?id=hb1511&ddBienniumSession=2025%2F2025R
1972611,2162,HB1512,4,Passed,2025-03-18,"To Create The Arkansas Access Act; And To Amend Various Provisions Of The Arkansas Code As They Relate To Education In The State Of Arkansas.","To Create The Arkansas Access Act; And To Amend Various Provisions Of The Arkansas Code As They Relate To Education In The State Of Arkansas.",0,,2025-03-18,"Notification that HB1512 is now Act 341",https://legiscan.com/AR/bill/HB1512/2025,https://arkleg.state.ar.us/Bills/Detail?id=hb1512&ddBienniumSession=2025%2F2025R
1972843,2162,HB1513,6,Failed,2025-05-05,"To Amend The Law Concerning Lottery-funded Scholarships.","To Amend The Law Concerning Lottery-funded Scholarships.",0,,2025-05-05,"Died in House Committee at Sine Die adjournment.",https://legiscan.com/AR/bill/HB1513/2025,https://arkleg.state.ar.us/Bills/Detail?id=hb1513&ddBienniumSession=2025%2F2025R
1973292,2162,HB1514,4,Passed,2025-03-06,"To Amend The Uniform Attendance And Leave Policy Act; And To Amend The Definition Of A &quot;critical-need Employee&quot;.","To Amend The Uniform Attendance And Leave Policy Act; And To Amend The Definition Of A &quot;critical-need Employee&quot;.",0,,2025-03-06,"Notification that HB1514 is now Act 253",https://legiscan.com/AR/bill/HB1514/2025,https://arkleg.state.ar.us/Bills/Detail?id=hb1514&ddBienniumSession=2025%2F2025R
1973154,2162,HB1515,4,Passed,2025-04-14,"To Amend The Law Concerning The Authority To Order The Arkansas National Guard Into Service; And To Authorize The Use Of The Arkansas National Guard For Matters Related To Military Justice And To Address Staffing Shortages.","To Amend The Law Concerning The Authority To Order The Arkansas National Guard Into Service; And To Authorize The Use Of The Arkansas National Guard For Matters Related To Military Justice And To Address Staffing Shortages.",0,,2025-04-14,"Notification that HB1515 is now Act 574",https://legiscan.com/AR/bill/HB1515/2025,https://arkleg.state.ar.us/Bills/Detail?id=hb1515&ddBienniumSession=2025%2F2025R
1973063,2162,HB1516,4,Passed,2025-03-18,"To Amend Various Laws Concerning The Department Of Agriculture.","To Amend Various Laws Concerning The Department Of Agriculture.",0,,2025-03-18,"Notification that HB1516 is now Act 326",https://legiscan.com/AR/bill/HB1516/2025,https://arkleg.state.ar.us/Bills/Detail?id=hb1516&ddBienniumSession=2025%2F2025R
1973583,2162,HB1517,4,Passed,2025-03-20,"To Establish The Earned Wage Access Services Act.","To Establish The Earned Wage Access Services Act.",0,,2025-03-20,"Notification that HB1517 is now Act 347",https://legiscan.com/AR/bill/HB1517/2025,https://arkleg.state.ar.us/Bills/Detail?id=hb1517&ddBienniumSession=2025%2F2025R
1973543,2162,HB1518,1,Introduced,2025-02-18,"To Create The Offense Of Creating, Distributing, Possessing, Or Viewing Artificial Intelligence-generated Matter Depicting Sexually Explicit Conduct Involving A Child.","To Create The Offense Of Creating, Distributing, Possessing, Or Viewing Artificial Intelligence-generated Matter Depicting Sexually Explicit Conduct Involving A Child.",0,,2025-03-18,"WITHDRAWN BY AUTHOR",https://legiscan.com/AR/bill/HB1518/2025,https://arkleg.state.ar.us/Bills/Detail?id=hb1518&ddBienniumSession=2025%2F2025R
1973507,2162,HB1519,6,Failed,2025-05-05,"To Allow The Secretary Of The Department Of Commerce To Participate In The Hiring And Contracting Of Employees For The State Insurance Department, State Bank Department, And State Securities Department.","To Allow The Secretary Of The Department Of Commerce To Participate In The Hiring And Contracting Of Employees For The State Insurance Department, State Bank Department, And State Securities Department.",0,,2025-05-05,"Died in House at Sine Die adjournment.",https://legiscan.com/AR/bill/HB1519/2025,https://arkleg.state.ar.us/Bills/Detail?id=hb1519&ddBienniumSession=2025%2F2025R
1973435,2162,HB1520,1,Introduced,2025-02-18,"To Require The Secretary Of The Department Of Finance And Administration And The Department Of Finance And Administration To Respond To A Written Request For A Legal Opinion Within A Certain Amount Of Time.","To Require The Secretary Of The Department Of Finance And Administration And The Department Of Finance And Administration To Respond To A Written Request For A Legal Opinion Within A Certain Amount Of Time.",0,,2025-03-04,"WITHDRAWN BY AUTHOR",https://legiscan.com/AR/bill/HB1520/2025,https://arkleg.state.ar.us/Bills/Detail?id=hb1520&ddBienniumSession=2025%2F2025R
1973468,2162,HB1521,1,Introduced,2025-02-18,"To Repeal Certain Unused, Underused, Or Unfunded Tax Incentives.","To Repeal Certain Unused, Underused, Or Unfunded Tax Incentives.",0,,2025-03-19,"Returned by the Committee Do Pass",https://legiscan.com/AR/bill/HB1521/2025,https://arkleg.state.ar.us/Bills/Detail?id=hb1521&ddBienniumSession=2025%2F2025R
1973623,2162,HB1522,4,Passed,2025-04-14,"To Amend The Law To Allow For The Distribution Of Funds In The Municipal Aid Fund, Turnback Funds, And County Sales And Use Tax Revenues To Newly Incorporated Municipalities; And To Declare An Emergency.","To Amend The Law To Allow For The Distribution Of Funds In The Municipal Aid Fund, Turnback Funds, And County Sales And Use Tax Revenues To Newly Incorporated Municipalities; And To Declare An Emergency.",0,,2025-04-14,"Notification that HB1522 is now Act 620",https://legiscan.com/AR/bill/HB1522/2025,https://arkleg.state.ar.us/Bills/Detail?id=hb1522&ddBienniumSession=2025%2F2025R
1973736,2162,HB1523,4,Passed,2025-04-21,"Concerning Missing Persons Alerts; To Codify The Arkansas Amber Alert System; To Codify The Arkansas Silver Alert System; And To Create The Missing Endangered Adult Advisory System.","Concerning Missing Persons Alerts; To Codify The Arkansas Amber Alert System; To Codify The Arkansas Silver Alert System; And To Create The Missing Endangered Adult Advisory System.",0,,2025-04-21,"Notification that HB1523 is now Act 951",https://legiscan.com/AR/bill/HB1523/2025,https://arkleg.state.ar.us/Bills/Detail?id=hb1523&ddBienniumSession=2025%2F2025R
1973771,2162,HB1524,4,Passed,2025-04-21,"To Amend The Law Concerning The Bidding Procedure For The Construction Of Buildings And Facilities.","To Amend The Law Concerning The Bidding Procedure For The Construction Of Buildings And Facilities.",0,,2025-04-21,"Notification that HB1524 is now Act 939",https://legiscan.com/AR/bill/HB1524/2025,https://arkleg.state.ar.us/Bills/Detail?id=hb1524&ddBienniumSession=2025%2F2025R
1973810,2162,HB1525,4,Passed,2025-04-21,"To Amend The Law Concerning Real Property; And To Address Agricultural Impact Remediation Agreements.","To Amend The Law Concerning Real Property; And To Address Agricultural Impact Remediation Agreements.",0,,2025-04-21,"Notification that HB1525 is now Act 923",https://legiscan.com/AR/bill/HB1525/2025,https://arkleg.state.ar.us/Bills/Detail?id=hb1525&ddBienniumSession=2025%2F2025R
1974639,2162,HB1526,4,Passed,2025-04-14,"To Authorize The Department Of The Military To Enter Into Public-private Partnerships; And To Amend The Law Concerning Gifts Received By The Department Of The Military.","To Authorize The Department Of The Military To Enter Into Public-private Partnerships; And To Amend The Law Concerning Gifts Received By The Department Of The Military.",0,,2025-04-14,"Notification that HB1526 is now Act 575",https://legiscan.com/AR/bill/HB1526/2025,https://arkleg.state.ar.us/Bills/Detail?id=hb1526&ddBienniumSession=2025%2F2025R
1975382,2162,HB1527,4,Passed,2025-03-18,"To Amend The Permissible Investments A Guardian Of The Estate May Make On Behalf Of A Ward.","To Amend The Permissible Investments A Guardian Of The Estate May Make On Behalf Of A Ward.",0,,2025-03-18,"Notification that HB1527 is now Act 315",https://legiscan.com/AR/bill/HB1527/2025,https://arkleg.state.ar.us/Bills/Detail?id=hb1527&ddBienniumSession=2025%2F2025R
1975473,2162,HB1528,6,Failed,2025-05-05,"To Require A Report Card To Include A Student&#x27;s Current Reading Grade Level.","To Require A Report Card To Include A Student&#x27;s Current Reading Grade Level.",0,,2025-05-05,"Died in House Committee at Sine Die adjournment.",https://legiscan.com/AR/bill/HB1528/2025,https://arkleg.state.ar.us/Bills/Detail?id=hb1528&ddBienniumSession=2025%2F2025R
1975427,2162,HB1529,4,Passed,2025-04-17,"To Create The Criminal Offense Of Unlawful Creation Or Distribution Of Deepfake Visual Material; And To Establish A Cause Of Action For Unlawful Creation Of Deepfake Visual Material.","To Create The Criminal Offense Of Unlawful Creation Or Distribution Of Deepfake Visual Material; And To Establish A Cause Of Action For Unlawful Creation Of Deepfake Visual Material.",0,,2025-04-17,"Notification that HB1529 is now Act 827",https://legiscan.com/AR/bill/HB1529/2025,https://arkleg.state.ar.us/Bills/Detail?id=hb1529&ddBienniumSession=2025%2F2025R
1975518,2162,HB1530,6,Failed,2025-05-05,"To Amend The Definition Of &quot;specialty Hospital&quot; Relating To The Assessment Fee On Hospitals Under The Arkansas Medicaid Program.","To Amend The Definition Of &quot;specialty Hospital&quot; Relating To The Assessment Fee On Hospitals Under The Arkansas Medicaid Program.",0,,2025-05-05,"Died in House Committee at Sine Die adjournment.",https://legiscan.com/AR/bill/HB1530/2025,https://arkleg.state.ar.us/Bills/Detail?id=hb1530&ddBienniumSession=2025%2F2025R
1975606,2162,HB1531,4,Passed,2025-04-16,"To Prohibit Pharmaceutical Manufacturers From Restricting Or Limiting Prescription Medications To A Limited Distribution Network Of Out-of-state Pharmacies.","To Prohibit Pharmaceutical Manufacturers From Restricting Or Limiting Prescription Medications To A Limited Distribution Network Of Out-of-state Pharmacies.",0,,2025-04-16,"Notification that HB1531 is now Act 630",https://legiscan.com/AR/bill/HB1531/2025,https://arkleg.state.ar.us/Bills/Detail?id=hb1531&ddBienniumSession=2025%2F2025R
